{
  "$schema": "http://json-schema.org/draft-07/schema#",
  "title": "Regulation Specification Schema",
  "description": "Schema για την περιγραφή κανονιστικών αποφάσεων τοπικής αυτοδιοίκησης με υποστήριξη αναφορών",
  "type": "object",
  "required": ["title", "contactEmail", "sources", "regulation"],
  "properties": {
    "title": {
      "type": "string",
      "description": "Ο τίτλος της κανονιστικής απόφασης"
    },
    "summary": {
      "type": "string",
      "description": "Περίληψη της κανονιστικής απόφασης σε markdown με δυνατότητα αναφορών {REF:id} και ορισμών {DEF:id}"
    },
    "contactEmail": {
      "type": "string",
      "format": "email",
      "description": "Email του δήμου για αποστολή σχολίων δημοτών"
    },
    "ccEmails": {
      "type": "array",
      "description": "Επιπρόσθετα emails για κοινοποίηση σχολίων (προαιρετικό)",
      "items": {
        "type": "string",
        "format": "email"
      }
    },
    "sources": {
      "type": "array",
      "description": "Πηγές του δήμου για την κανονιστική (π.χ. αρχικό PDF)",
      "items": {
        "type": "object",
        "required": ["title", "url"],
        "properties": {
          "title": {
            "type": "string",
            "description": "Τίτλος της πηγής"
          },
          "url": {
            "type": "string",
            "format": "uri",
            "description": "URL της πηγής"
          },
          "description": {
            "type": "string",
            "description": "Προαιρετική περιγραφή της πηγής"
          }
        }
      }
    },
    "referenceFormat": {
      "type": "object",
      "description": "Καθορίζει τη μορφή των αναφορών στο κείμενο",
      "properties": {
        "pattern": {
          "type": "string",
          "default": "{REF:([a-zA-Z][a-zA-Z0-9_-]*)}",
          "description": "Regex pattern για την αναγνώριση αναφορών"
        },
        "syntax": {
          "type": "string",
          "default": "{REF:id}",
          "description": "Παράδειγμα σύνταξης αναφοράς"
        }
      }
    },
    "definitionFormat": {
      "type": "object",
      "description": "Καθορίζει τη μορφή των αναφορών σε ορισμούς στο κείμενο",
      "properties": {
        "pattern": {
          "type": "string",
          "default": "\\{DEF:([a-zA-Z][a-zA-Z0-9_-]*)(?::([^}]+))?\\}",
          "description": "Regex pattern για την αναγνώριση αναφορών σε ορισμούς με προαιρετικό κείμενο εμφάνισης"
        },
        "syntax": {
          "type": "string",
          "default": "{DEF:id} ή {DEF:id:κείμενο_εμφάνισης}",
          "description": "Παράδειγμα σύνταξης αναφοράς σε ορισμό. Χρησιμοποιήστε {DEF:id} για εμφάνιση του όρου ή {DEF:id:κείμενο} για προσαρμοσμένο κείμενο εμφάνισης"
        }
      }
    },
    "defaultVisibleGeosets": {
      "type": "array",
      "description": "Λίστα με τα IDs των geosets που θα είναι ορατά by default στο χάρτη",
      "items": {
        "type": "string",
        "pattern": "^[a-zA-Z][a-zA-Z0-9_-]*$"
      }
    },
    "defaultView": {
      "type": "string",
      "enum": ["map", "document"],
      "default": "document",
      "description": "Η προβολή που ανοίγει πρώτη (χάρτης ή κείμενο)"
    },
    "addressLookup": {
      "type": "object",
      "description": "Τι βλέπει ο πολίτης για τη διεύθυνσή του (Βρες τον δρόμο σου)",
      "properties": {
        "zoneGeoSetId": {
          "type": "string",
          "pattern": "^[a-zA-Z][a-zA-Z0-9_-]*$",
          "description": "Το geoset περιοχών που απαντά σε ποια ζώνη ανήκει η διεύθυνση"
        },
        "streetGeoSetIds": {
          "type": "array",
          "description": "Geosets πολυγώνων που εμφανίζονται ως «στον δρόμο σας». Προεπιλογή: όλα τα geosets πολυγώνων εκτός από το zoneGeoSetId",
          "items": {
            "type": "string",
            "pattern": "^[a-zA-Z][a-zA-Z0-9_-]*$"
          }
        },
        "streetRadiusMeters": {
          "type": "number",
          "exclusiveMinimum": 0,
          "default": 30,
          "description": "Ακτίνα σε μέτρα για το «στον δρόμο σας»"
        },
        "streetMaxItems": {
          "type": "integer",
          "minimum": 1,
          "default": 4,
          "description": "Πόσα στοιχεία δείχνει το «στον δρόμο σας»"
        },
        "nearbyGeoSetIds": {
          "type": "array",
          "description": "Geosets των οποίων το πλησιέστερο στοιχείο εμφανίζεται ως «κοντά σας». Προεπιλογή: όλα τα geosets σημείων",
          "items": {
            "type": "string",
            "pattern": "^[a-zA-Z][a-zA-Z0-9_-]*$"
          }
        },
        "nearbyRadiusMeters": {
          "type": "number",
          "exclusiveMinimum": 0,
          "default": 400,
          "description": "Ακτίνα σε μέτρα για το «κοντά σας»"
        },
        "noZoneText": {
          "type": "string",
          "description": "Markdown που εμφανίζεται όταν καμία ζώνη δεν περιέχει τη διεύθυνση"
        }
      }
    },
    "overview": {
      "type": "array",
      "description": "«Το σχέδιο σε 2 λεπτά»: κάρτες σε απλή γλώσσα πριν από το πλήρες κείμενο",
      "items": {
        "type": "object",
        "required": ["id", "title", "body"],
        "properties": {
          "id": {
            "type": "string",
            "pattern": "^[a-zA-Z][a-zA-Z0-9_-]*$"
          },
          "title": {
            "type": "string"
          },
          "body": {
            "type": "string",
            "description": "Κείμενο σε markdown"
          },
          "commentOn": {
            "type": "string",
            "pattern": "^[a-zA-Z][a-zA-Z0-9_-]*$",
            "description": "Το id του κεφαλαίου, άρθρου, geoset ή γεωμετρίας όπου πηγαίνουν τα σχόλια της κάρτας"
          },
          "commentLabel": {
            "type": "string",
            "description": "Κείμενο του συνδέσμου σχολίου (προεπιλογή «Σχολιάστε»)"
          },
          "explains": {
            "type": "array",
            "description": "Τα geosets που εξηγεί η κάρτα· τα στοιχεία τους παραπέμπουν σε αυτήν",
            "items": {
              "type": "string",
              "pattern": "^[a-zA-Z][a-zA-Z0-9_-]*$"
            }
          },
          "linkLabel": {
            "type": "string",
            "description": "Κείμενο του συνδέσμου από ένα στοιχείο προς την κάρτα (προεπιλογή ο τίτλος)"
          }
        }
      }
    },
    "definitions": {
      "type": "object",
      "description": "Λεξικό ορισμών όρων που χρησιμοποιούνται στον κανονισμό",
      "additionalProperties": false,
      "patternProperties": {
        "^[a-zA-Z][a-zA-Z0-9_-]*$": {
          "type": "object",
          "required": ["term", "definition"],
          "properties": {
            "term": {
              "type": "string",
              "description": "Ο όρος που ορίζεται"
            },
            "definition": {
              "type": "string", 
              "description": "Ορισμός του όρου σε markdown με δυνατότητα αναφορών {REF:id} και ορισμών {DEF:id}"
            }
          }
        }
      }
    },
    "regulation": {
      "type": "array",
      "description": "Το κύριο μέρος της κανονιστικής - array από sections",
      "items": {
        "oneOf": [
          {
            "$ref": "#/definitions/Chapter"
          },
          {
            "$ref": "#/definitions/GeoSet"
          }
        ]
      }
    }
  },
  "definitions": {
    "Chapter": {
      "type": "object",
      "description": "Κεφάλαιο με άρθρα",
      "required": ["type", "num", "id", "title", "summary", "articles"],
      "properties": {
        "type": {
          "type": "string",
          "const": "chapter"
        },
        "num": {
          "type": "integer",
          "description": "Αριθμός κεφαλαίου"
        },
        "id": {
          "type": "string",
          "pattern": "^[a-zA-Z][a-zA-Z0-9_-]*$",
          "description": "Σύντομο ID στα αγγλικά"
        },
        "title": {
          "type": "string",
          "description": "Τίτλος κεφαλαίου"
        },
        "summary": {
          "type": "string",
          "description": "Περίληψη κεφαλαίου"
        },
        "preludeBody": {
          "type": "string",
          "description": "Εισαγωγικό κείμενο σε markdown που εμφανίζεται πριν από όλα τα άρθρα με δυνατότητα αναφορών {REF:id} και ορισμών {DEF:id}"
        },
        "articles": {
          "type": "array",
          "description": "Άρθρα του κεφαλαίου",
          "items": {
            "$ref": "#/definitions/Article"
          }
        }
      }
    },
    "Article": {
      "type": "object",
      "description": "Άρθρο κανονιστικής",
      "required": ["num", "id", "title", "summary", "body"],
      "properties": {
        "num": {
          "type": "integer",
          "description": "Αριθμός άρθρου"
        },
        "id": {
          "type": "string",
          "pattern": "^[a-zA-Z][a-zA-Z0-9_-]*$",
          "description": "Σύντομο ID στα αγγλικά"
        },
        "title": {
          "type": "string",
          "description": "Τίτλος άρθρου"
        },
        "summary": {
          "type": "string",
          "description": "Περίληψη άρθρου"
        },
        "body": {
          "type": "string",
          "description": "Κύριο κείμενο άρθρου σε markdown με δυνατότητα αναφορών {REF:id} και ορισμών {DEF:id}"
        }
      }
    },
    "GeoSet": {
      "type": "object",
      "description": "Σύνολο γεωγραφικών τοποθεσιών",
      "required": ["type", "id", "name", "geometries"],
      "properties": {
        "type": {
          "type": "string",
          "const": "geoset"
        },
        "id": {
          "type": "string",
          "pattern": "^[a-zA-Z][a-zA-Z0-9_-]*$",
          "description": "Σύντομο ID στα αγγλικά"
        },
        "name": {
          "type": "string",
          "description": "Όνομα του συνόλου γεωγραφικών τοποθεσιών"
        },
        "description": {
          "type": "string",
          "description": "Προαιρετική σημασιολογική περιγραφή του συνόλου γεωγραφικών περιοχών (π.χ. 'Περιοχές όπου απαγορεύεται η κυκλοφορία ηλεκτρικών πατινιών για λόγους ασφαλείας')"
        },
        "color": {
          "type": "string",
          "pattern": "^#([A-Fa-f0-9]{6}|[A-Fa-f0-9]{3})$",
          "description": "Χρώμα του geoset σε hex μορφή (π.χ. #FF5733)"
        },
        "legend": {
          "type": "string",
          "description": "Σύντομη ετικέτα για το υπόμνημα του χάρτη· χωρίς αυτήν το geoset δεν εμφανίζεται στο υπόμνημα"
        },
        "mapStyle": {
          "type": "object",
          "description": "Προαιρετικές οδηγίες απεικόνισης του geoset στον χάρτη",
          "properties": {
            "fillOpacity": {
              "type": "number",
              "minimum": 0,
              "maximum": 1,
              "description": "Αδιαφάνεια γεμίσματος (προεπιλογή 0.4)"
            },
            "strokeWidth": {
              "type": "number",
              "minimum": 0,
              "description": "Πάχος περιγράμματος σε px. Για σημεία είναι η ακτίνα του κύκλου"
            },
            "showLabels": {
              "type": "boolean",
              "default": true,
              "description": "false: καμία ετικέτα στον χάρτη για τις γεωμετρίες του geoset"
            },
            "hover": {
              "type": "boolean",
              "default": true,
              "description": "false: χωρίς επισήμανση κατά το hover (παραμένει clickable)"
            }
          }
        },
        "geometries": {
          "type": "array",
          "description": "Γεωγραφικές τοποθεσίες",
          "items": {
            "$ref": "#/definitions/Geometry"
          }
        }
      }
    },
    "Geometry": {
      "type": "object",
      "description": "Γεωγραφική τοποθεσία. Μπορεί να οριστεί είτε στατικά μέσω 'geojson' είτε δυναμικά μέσω 'derivedFrom'.",
      "required": [
        "type",
        "name",
        "id"
      ],
      "properties": {
        "type": {
          "type": "string",
          "enum": [
            "point",
            "circle",
            "polygon",
            "derived"
          ],
          "description": "Τύπος γεωμετρίας. Ο τύπος 'derived' υποδεικνύει ότι η γεωμετρία υπολογίζεται από άλλα GeoSets."
        },
        "name": {
          "type": "string",
          "description": "Όνομα τοποθεσίας"
        },
        "id": {
          "type": "string",
          "pattern": "^[a-zA-Z][a-zA-Z0-9_-]*$",
          "description": "Σύντομο ID στα αγγλικά"
        },
        "description": {
          "type": "string",
          "description": "Προαιρετική σημασιολογική περιγραφή της τοποθεσίας (π.χ. σκοπός, λειτουργία, χαρακτηριστικά)"
        },
        "textualDefinition": {
          "type": "string",
          "description": "Προαιρετικός γεωγραφικός προσδιορισμός της περιοχής με λόγια (π.χ. διεύθυνση, όρια, ορόσημα)"
        },
        "geojson": {
          "description": "GeoJSON αντίστοιχου σχήματος. Απαιτείται αν ο τύπος δεν είναι 'derived'.",
          "oneOf": [
            {
              "$ref": "#/definitions/GeoJSONPoint"
            },
            {
              "$ref": "#/definitions/GeoJSONPolygon"
            },
            {
              "$ref": "#/definitions/GeoJSONMultiPolygon"
            }
          ]
        },
        "derivedFrom": {
          "description": "Ορισμός παραγόμενης γεωμετρίας. Απαιτείται αν ο τύπος είναι 'derived'.",
          "$ref": "#/definitions/GeometryDerivation"
        }
      },
      "allOf": [
        {
          "if": {
            "properties": {
              "type": {
                "const": "derived"
              }
            }
          },
          "then": {
            "required": [
              "derivedFrom"
            ],
            "properties": {
              "geojson": false
            }
          },
          "else": {
            "required": [
              "geojson"
            ],
            "properties": {
              "derivedFrom": false
            }
          }
        }
      ]
    },
    "GeoJSONPoint": {
      "type": "object",
      "required": ["type", "coordinates"],
      "properties": {
        "type": {
          "type": "string",
          "const": "Point"
        },
        "coordinates": {
          "type": "array",
          "minItems": 2,
          "maxItems": 3,
          "items": {
            "type": "number"
          },
          "description": "[longitude, latitude] ή [longitude, latitude, elevation]"
        }
      }
    },
    "GeoJSONPolygon": {
      "type": "object",
      "required": ["type", "coordinates"],
      "properties": {
        "type": {
          "type": "string",
          "const": "Polygon"
        },
        "coordinates": {
          "type": "array",
          "items": {
            "type": "array",
            "minItems": 4,
            "items": {
              "type": "array",
              "minItems": 2,
              "maxItems": 3,
              "items": {
                "type": "number"
              }
            }
          },
          "description": "Array από linear rings, όπου το πρώτο είναι το εξωτερικό boundary"
        }
      }
    },
    "GeoJSONMultiPolygon": {
      "type": "object",
      "required": ["type", "coordinates"],
      "properties": {
        "type": {
          "type": "string",
          "const": "MultiPolygon"
        },
        "coordinates": {
          "type": "array",
          "items": {
            "type": "array",
            "items": {
              "type": "array",
              "minItems": 4,
              "items": {
                "type": "array",
                "minItems": 2,
                "maxItems": 3,
                "items": {
                  "type": "number"
                }
              }
            }
          },
          "description": "Array από πολύγωνα, καθένα array από linear rings"
        }
      }
    },
    "GeometryDerivation": {
      "description": "Ορισμός γεωμετρίας που προκύπτει από άλλα GeoSet μέσω γεωμετρικών πράξεων.",
      "oneOf": [
        {
          "$ref": "#/definitions/BufferOperation"
        },
        {
          "$ref": "#/definitions/DifferenceOperation"
        }
      ]
    },
    "BufferOperation": {
      "type": "object",
      "description": "Δημιουργεί μια ζώνη (buffer) γύρω από τις γεωμετρίες ενός GeoSet.",
      "required": [
        "operation",
        "sourceGeoSetId",
        "radius"
      ],
      "properties": {
        "operation": {
          "const": "buffer",
          "description": "Η πράξη που θα εκτελεστεί."
        },
        "sourceGeoSetId": {
          "type": "string",
          "pattern": "^[a-zA-Z][a-zA-Z0-9_-]*$",
          "description": "Το ID του GeoSet-πηγής."
        },
        "radius": {
          "type": "number",
          "description": "Η ακτίνα της ζώνης."
        },
        "units": {
          "type": "string",
          "enum": [
            "meters",
            "kilometers"
          ],
          "default": "meters",
          "description": "Οι μονάδες της ακτίνας."
        }
      }
    },
    "DifferenceOperation": {
      "type": "object",
      "description": "Δημιουργεί μια γεωμετρία αφαιρώντας ένα ή περισσότερα GeoSet από ένα βασικό GeoSet.",
      "required": [
        "operation",
        "baseGeoSetId",
        "subtractGeoSetIds"
      ],
      "properties": {
        "operation": {
          "const": "difference",
          "description": "Η πράξη που θα εκτελεστεί."
        },
        "baseGeoSetId": {
          "type": "string",
          "pattern": "^[a-zA-Z][a-zA-Z0-9_-]*$",
          "description": "Το ID του βασικού GeoSet από το οποίο θα γίνει η αφαίρεση. Πρέπει να είναι ένα GeoSet με μία μόνο γεωμετρία τύπου polygon (π.χ. τα όρια του Δήμου)."
        },
        "subtractGeoSetIds": {
          "type": "array",
          "description": "Λίστα με τα IDs των GeoSet που θα αφαιρεθούν.",
          "items": {
            "type": "string",
            "pattern": "^[a-zA-Z][a-zA-Z0-9_-]*$"
          }
        }
      }
    }
  }
}