{
  "title": "Χωροθέτηση θέσεων τοποθέτησης κάδων συλλογής βρώσιμων φυτικών ελαίων και λιπών (τηγανελαίων) στις 7 Δημοτικές Κοινότητες του Δήμου Αθηναίων",
  "summary": "Πρόταση για την εγκατάσταση δικτύου **230 ειδικών κάδων** συλλογής τηγανελαίων στις 7 Δημοτικές Κοινότητες του Δήμου Αθηναίων. Σε κάθε θέση θα τοποθετηθούν 1-2 κάδοι. Δείτε τις προτεινόμενες τοποθεσίες στον χάρτη: {REF:dk_1}, {REF:dk_2}, {REF:dk_3}, {REF:dk_4}, {REF:dk_5}, {REF:dk_6}, {REF:dk_7}.",
  "contactEmail": "t.enallaktikis.diax.apovliton@athens.gr",
  "sources": [
    {
      "title": "Εισηγητικό Χωροθέτησης Θέσεων",
      "url": "https://www.cityofathens.gr/wp-content/uploads/2026/02/eisigitiko-chorothetisi-theseon-topothetisis-kadon-syllogis-vrosimon-fytikon-elaion.pdf",
      "description": "Το πλήρες εισηγητικό έγγραφο με τις προτεινόμενες θέσεις ανά Δημοτική Κοινότητα"
    },
    {
      "title": "Δημοσίευση Διαβούλευσης",
      "url": "https://www.cityofathens.gr/diavoyleysi-gia-tin-chorothetisi-these/",
      "description": "Η σελίδα της δημόσιας διαβούλευσης στον ιστότοπο του Δήμου Αθηναίων"
    }
  ],
  "defaultVisibleGeosets": [
    "dk_1",
    "dk_2",
    "dk_3",
    "dk_4",
    "dk_5",
    "dk_6",
    "dk_7"
  ],
  "regulation": [
    {
      "type": "chapter",
      "num": 1,
      "id": "eisigitiko",
      "title": "Εισηγητικό",
      "summary": "Πρόταση της Δ/νσης Καθαριότητας - Ανακύκλωσης για χωροθέτηση 230 θέσεων κάδων συλλογής τηγανελαίων.",
      "articles": [
        {
          "num": 1,
          "id": "nomiko-plaisio",
          "title": "Νομικό Πλαίσιο & Αποφάσεις",
          "summary": "Αποφάσεις Δημοτικών Κοινοτήτων και Δημοτικού Συμβουλίου που αποτελούν τη βάση της πρότασης.",
          "body": "Η πρόταση βασίζεται στις ακόλουθες αποφάσεις:\n\n1. Απόφαση 167/03.02.2025 της **1ης Δημοτικής Κοινότητας** (ΑΔΑ: 9ΠΩ5Ω6Μ-ΠΦΦ)\n2. Απόφαση 23/06.02.2025 της **2ης Δημοτικής Κοινότητας** (ΑΔΑ: 9ΕΓΧΩ6Μ-ΥΥΙ)\n3. Απόφαση 42/18.02.2025 της **3ης Δημοτικής Κοινότητας** (ΑΔΑ: Ψ3ΘΧΩΞΜ-99Γ)\n4. Απόφαση 20/17.02.2025 της **4ης Δημοτικής Κοινότητας** (ΑΔΑ: 91Γ3Ω6Μ-ΧΥΑ)\n5. Απόφαση 22/27.02.2025 της **5ης Δημοτικής Κοινότητας** (ΑΔΑ: 9ΧΛΗΩ6Μ-ΤΨ7)\n6. Απόφαση 30/12.03.2025 της **6ης Δημοτικής Κοινότητας** (ΑΔΑ: 9Θ69Ω6Μ-Δ6Μ)\n7. Απόφαση 22/20.02.2025 της **7ης Δημοτικής Κοινότητας** (ΑΔΑ: ΡΡΤΕΩ6Μ-ΝΜ6)\n8. Απόφαση 92677/08.02.2024 της Εκτιμητικής Επιτροπής (άρθρο 186 παρ. 5 Ν.3463/2006)\n9. Απόφαση 694/25.11.2024 του Δημοτικού Συμβουλίου (ΑΔΑ: ΨΔΖΩ6Μ-43Ω) για τη διεξαγωγή πρόχειρου προφορικού πλειοδοτικού διαγωνισμού\n10. Νόμοι: Ν.4555/2018 «ΚΛΕΙΣΘΕΝΗΣ Ι», Ν.3852/2010 «Καλλικράτης», Ν.5056/2023"
        },
        {
          "num": 2,
          "id": "protasi",
          "title": "Πρόταση Χωροθέτησης",
          "summary": "Πρόταση για εγκατάσταση 230 κάδων τηγανελαίων σε 7 Δημοτικές Κοινότητες.",
          "body": "Η Δ/νση Καθαριότητας – Ανακύκλωσης αποστέλλει προς έγκριση **230 θέσεις** χωροθέτησης κάδων συλλογής βρώσιμων φυτικών ελαίων και λιπών (τηγανελαίων) στις 7 Δημοτικές Κοινότητες.\n\nΗ αρχική απόφαση (694/25.11.2024) προέβλεπε δίκτυο **150 κάδων**. Ωστόσο, για την καλύτερη εξυπηρέτηση και αποφυγή συνεχών τροποποιήσεων, εισηγείται η χωροθέτηση **230 θέσεων**.\n\nΣε κάθε θέση θα τοποθετηθούν **1 έως 2 κάδοι**.\n\nΟι προτεινόμενες θέσεις ανά Δημοτική Κοινότητα:\n- {REF:dk_1}: 38 θέσεις\n- {REF:dk_2}: 27 θέσεις\n- {REF:dk_3}: 23 θέσεις\n- {REF:dk_4}: 31 θέσεις\n- {REF:dk_5}: 30 θέσεις\n- {REF:dk_6}: 25 θέσεις\n- {REF:dk_7}: 36 θέσεις\n\nΗ ροή τηγανελαίων είναι συνεχώς εξελισσόμενη. Αποφεύγεται η ταφή τους σε ΧΥΤΑ, προωθείται η περιβαλλοντική ευαισθητοποίηση, και ο Δήμος εναρμονίζεται με το εγκεκριμένο ΕΣΔΑ και το τοπικό Σχέδιο Διαχείρισης Αποβλήτων."
        },
        {
          "num": 3,
          "id": "diavoulefsi",
          "title": "Όροι Διαβούλευσης",
          "summary": "Χρονικό πλαίσιο και τρόπος υποβολής παρατηρήσεων.",
          "body": "Η διαβούλευση διαρκεί **7 ημέρες** (11-18 Φεβρουαρίου 2026).\n\n**Προθεσμία υποβολής:** Τετάρτη 18 Φεβρουαρίου 2026, ώρα 09:00.\n\n**Τρόποι υποβολής προτάσεων:**\n- **Email:** t.enallaktikis.diax.apovliton@athens.gr\n- **Αυτοπροσώπως:** Δημοτική Επιτροπή, Λιοσίων 22, 6ος Όροφος, τηλ. 210 5277432\n\n**Αρμόδια Υπηρεσία:** Δ/νση Καθαριότητας - Ανακύκλωσης, Τμήμα Εναλλακτικής Διαχείρισης Αποβλήτων, Ιερά Οδός 151, τηλ. 210 3402446\n\nΜετά το πέρας της διαβούλευσης, η Δ/νση Καθαριότητας - Ανακύκλωσης θα επεξεργαστεί τα σχόλια και θα οριστικοποιήσει την πρόταση."
        }
      ]
    },
    {
      "type": "geoset",
      "id": "dk_1",
      "name": "1η Δημοτική Κοινότητα",
      "description": "Θέσεις τοποθέτησης κάδων συλλογής τηγανελαίων στην 1η Δημοτική Κοινότητα (38 θέσεις)",
      "color": "#E63946",
      "geometries": [
        {
          "type": "point",
          "name": "ΣΚΟΥΦΑ 55-57",
          "id": "dk1_01_5557",
          "textualDefinition": "ΣΚΟΥΦΑ 55-57, 1η Δημοτική Κοινότητα, Αθήνα",
          "geojson": {
            "type": "Point",
            "coordinates": [
              23.7377391,
              37.9806191
            ]
          }
        },
        {
          "type": "point",
          "name": "Π. ΙΩΑΚΕΙΜ 42",
          "id": "dk1_02_42",
          "textualDefinition": "Π. ΙΩΑΚΕΙΜ 42, 1η Δημοτική Κοινότητα, Αθήνα",
          "geojson": {
            "type": "Point",
            "coordinates": [
              23.744656,
              37.97792219999999
            ]
          }
        },
        {
          "type": "point",
          "name": "ΠΛΟΥΤΑΡΧΟΥ 13",
          "id": "dk1_03_13",
          "textualDefinition": "ΠΛΟΥΤΑΡΧΟΥ 13, 1η Δημοτική Κοινότητα, Αθήνα",
          "geojson": {
            "type": "Point",
            "coordinates": [
              23.7450757,
              37.97761879999999
            ]
          }
        },
        {
          "type": "point",
          "name": "ΚΑΡΝΕΑΔΟΥ 29 & ΠΛΟΥΤΑΡΧΟΥ",
          "id": "dk1_04_29",
          "textualDefinition": "ΚΑΡΝΕΑΔΟΥ 29 & ΠΛΟΥΤΑΡΧΟΥ, 1η Δημοτική Κοινότητα, Αθήνα",
          "geojson": {
            "type": "Point",
            "coordinates": [
              23.7449649,
              37.9772039
            ]
          }
        },
        {
          "type": "point",
          "name": "ΣΚΟΥΦΑ & ΓΡΙΒΕΩΝ",
          "id": "dk1_05_point",
          "textualDefinition": "ΣΚΟΥΦΑ & ΓΡΙΒΕΩΝ, 1η Δημοτική Κοινότητα, Αθήνα",
          "geojson": {
            "type": "Point",
            "coordinates": [
              23.7367247,
              37.9821836
            ]
          }
        },
        {
          "type": "point",
          "name": "ΣΠΕΥΣΙΠΠΟΥ & ΧΑΡΙΤΟΣ",
          "id": "dk1_06_point",
          "textualDefinition": "ΣΠΕΥΣΙΠΠΟΥ & ΧΑΡΙΤΟΣ, 1η Δημοτική Κοινότητα, Αθήνα",
          "geojson": {
            "type": "Point",
            "coordinates": [
              23.74175,
              37.9783627
            ]
          }
        },
        {
          "type": "point",
          "name": "ΗΡΟΔΟΤΟΥ & ΛΕΒΕΝΤΗ",
          "id": "dk1_07_point",
          "textualDefinition": "ΗΡΟΔΟΤΟΥ & ΛΕΒΕΝΤΗ, 1η Δημοτική Κοινότητα, Αθήνα",
          "geojson": {
            "type": "Point",
            "coordinates": [
              23.7426128,
              37.9758464
            ]
          }
        },
        {
          "type": "point",
          "name": "ΞΕΝΟΚΡΑΤΟΥΣ ΕΝ. 17-19",
          "id": "dk1_08_1719",
          "textualDefinition": "ΞΕΝΟΚΡΑΤΟΥΣ ΕΝ. 17-19, 1η Δημοτική Κοινότητα, Αθήνα",
          "geojson": {
            "type": "Point",
            "coordinates": [
              23.7456902,
              37.9794256
            ]
          }
        },
        {
          "type": "point",
          "name": "ΜΗΤΡΟΠΟΛΕΩΣ 48",
          "id": "dk1_09_48",
          "textualDefinition": "ΜΗΤΡΟΠΟΛΕΩΣ 48, 1η Δημοτική Κοινότητα, Αθήνα",
          "geojson": {
            "type": "Point",
            "coordinates": [
              23.7302805,
              37.9755534
            ]
          }
        },
        {
          "type": "point",
          "name": "ΚΟΛΟΚΟΤΡΩΝΗ & ΒΑΣΙΛΙΚΗΣ",
          "id": "dk1_10_point",
          "textualDefinition": "ΚΟΛΟΚΟΤΡΩΝΗ & ΒΑΣΙΛΙΚΗΣ, 1η Δημοτική Κοινότητα, Αθήνα",
          "geojson": {
            "type": "Point",
            "coordinates": [
              23.7281628,
              37.977424
            ]
          }
        },
        {
          "type": "point",
          "name": "ΑΘΗΝΑΣ 16 (ΜΑΣΟΥΤΗΣ)",
          "id": "dk1_11_16",
          "textualDefinition": "ΑΘΗΝΑΣ 16 (ΜΑΣΟΥΤΗΣ), 1η Δημοτική Κοινότητα, Αθήνα",
          "geojson": {
            "type": "Point",
            "coordinates": [
              23.7265934,
              37.9778612
            ]
          }
        },
        {
          "type": "point",
          "name": "ΑΙΟΛΟΥ & ΑΝΔΡΙΑΝΟΥ",
          "id": "dk1_12_point",
          "textualDefinition": "ΑΙΟΛΟΥ & ΑΝΔΡΙΑΝΟΥ, 1η Δημοτική Κοινότητα, Αθήνα",
          "geojson": {
            "type": "Point",
            "coordinates": [
              23.7213881,
              37.9768778
            ]
          }
        },
        {
          "type": "point",
          "name": "ΠΛ. ΚΑΝΙΓΓΟΣ",
          "id": "dk1_13_point",
          "textualDefinition": "ΠΛ. ΚΑΝΙΓΓΟΣ, 1η Δημοτική Κοινότητα, Αθήνα",
          "geojson": {
            "type": "Point",
            "coordinates": [
              23.7303859,
              37.9846224
            ]
          }
        },
        {
          "type": "point",
          "name": "ΙΠΠΟΚΡΑΤΟΥΣ & ΔΙΔΟΤΟΥ",
          "id": "dk1_14_point",
          "textualDefinition": "ΙΠΠΟΚΡΑΤΟΥΣ & ΔΙΔΟΤΟΥ, 1η Δημοτική Κοινότητα, Αθήνα",
          "geojson": {
            "type": "Point",
            "coordinates": [
              23.7378402,
              37.9817708
            ]
          }
        },
        {
          "type": "point",
          "name": "ΜΠΕΝΑΚΗ & ΒΑΛΤΕΤΣΙΟΥ",
          "id": "dk1_15_point",
          "textualDefinition": "ΜΠΕΝΑΚΗ & ΒΑΛΤΕΤΣΙΟΥ, 1η Δημοτική Κοινότητα, Αθήνα",
          "geojson": {